[
  {
    "iteration": "1",
    "kind": "phase_start",
    "payload": {
      "command": [
        "codex",
        "review",
        "-c",
        "sandbox_mode=\"read-only\"",
        "--base",
        "main"
      ],
      "harness": "codex",
      "message": "codex review · sandbox read-only · source=direct-config",
      "payload_schema_version": "1.1",
      "prompt_delivery": "none",
      "summary": "start"
    },
    "phase": "review",
    "run_id": "deadbeefcafe0000deadbeefcafe0000",
    "schema_version": "1.0",
    "seq": 1,
    "ts": "2026-01-02T03:04:05Z"
  },
  {
    "iteration": "1",
    "kind": "model_invocation",
    "payload": {
      "duration_seconds": 0.0,
      "harness": "codex",
      "model": null,
      "outcome": "ok",
      "reasoning_effort": null,
      "returncode": 0,
      "tokens": 100
    },
    "phase": "review",
    "run_id": "deadbeefcafe0000deadbeefcafe0000",
    "schema_version": "1.0",
    "seq": 2,
    "ts": "2026-01-02T03:04:05Z"
  },
  {
    "iteration": "1",
    "kind": "cost_charge",
    "payload": {
      "tokens": 100,
      "usd": null
    },
    "phase": "review",
    "run_id": "deadbeefcafe0000deadbeefcafe0000",
    "schema_version": "1.0",
    "seq": 3,
    "ts": "2026-01-02T03:04:05Z"
  },
  {
    "iteration": "1",
    "kind": "cost_ceiling_hit",
    "payload": {
      "actual": 100,
      "ceiling": "tokens",
      "limit": 10,
      "message": "tokens budget reached: 100 >= 10"
    },
    "phase": "review",
    "run_id": "deadbeefcafe0000deadbeefcafe0000",
    "schema_version": "1.0",
    "seq": 4,
    "ts": "2026-01-02T03:04:05Z"
  },
  {
    "iteration": null,
    "kind": "artifact_write",
    "payload": {
      "kind": "summary",
      "path": "<RUN_DIR>/artifacts/summary.json"
    },
    "phase": "artifacts",
    "run_id": "deadbeefcafe0000deadbeefcafe0000",
    "schema_version": "1.0",
    "seq": 5,
    "ts": "2026-01-02T03:04:05Z"
  },
  {
    "iteration": null,
    "kind": "artifact_write",
    "payload": {
      "bytes": 24,
      "kind": "reviews",
      "path": "<RUN_DIR>/artifacts/review-1.txt"
    },
    "phase": "artifacts",
    "run_id": "deadbeefcafe0000deadbeefcafe0000",
    "schema_version": "1.0",
    "seq": 6,
    "ts": "2026-01-02T03:04:05Z"
  },
  {
    "iteration": null,
    "kind": "summary",
    "payload": {
      "summary": "budget_ceiling_hit"
    },
    "phase": null,
    "run_id": "deadbeefcafe0000deadbeefcafe0000",
    "schema_version": "1.0",
    "seq": 7,
    "ts": "2026-01-02T03:04:05Z"
  }
]
