[
  {
    "iteration": "1",
    "kind": "phase_start",
    "payload": {
      "command": [
        "codex",
        "review",
        "-c",
        "sandbox_mode=\"read-only\"",
        "--base",
        "main"
      ],
      "harness": "codex",
      "message": "codex review · sandbox read-only · source=direct-config",
      "payload_schema_version": "1.1",
      "prompt_delivery": "none",
      "summary": "start"
    },
    "phase": "review",
    "run_id": "deadbeefcafe0000deadbeefcafe0000",
    "schema_version": "1.0",
    "seq": 1,
    "ts": "2026-01-02T03:04:05Z"
  },
  {
    "iteration": "1",
    "kind": "model_invocation",
    "payload": {
      "duration_seconds": 0.0,
      "harness": "codex",
      "model": null,
      "outcome": "ok",
      "reasoning_effort": null,
      "returncode": 0,
      "tokens": null
    },
    "phase": "review",
    "run_id": "deadbeefcafe0000deadbeefcafe0000",
    "schema_version": "1.0",
    "seq": 2,
    "ts": "2026-01-02T03:04:05Z"
  },
  {
    "iteration": "1",
    "kind": "phase_result",
    "payload": {
      "summary": "findings"
    },
    "phase": "review",
    "run_id": "deadbeefcafe0000deadbeefcafe0000",
    "schema_version": "1.0",
    "seq": 3,
    "ts": "2026-01-02T03:04:05Z"
  },
  {
    "iteration": "1",
    "kind": "phase_start",
    "payload": {
      "command": [
        "codex",
        "exec",
        "--approve-for-me",
        "--color",
        "never",
        "--output-last-message",
        "<RUN_DIR>/artifacts/remediation-1-last-message.txt",
        "-"
      ],
      "harness": "codex",
      "message": "codex exec · sandbox workspace-write · prompt=1.1k stdin · source=direct-config",
      "payload_schema_version": "1.1",
      "prompt_bytes": 1150,
      "prompt_chars": 1150,
      "prompt_delivery": "stdin",
      "summary": "start"
    },
    "phase": "remediate",
    "run_id": "deadbeefcafe0000deadbeefcafe0000",
    "schema_version": "1.0",
    "seq": 4,
    "ts": "2026-01-02T03:04:05Z"
  },
  {
    "iteration": "1",
    "kind": "model_invocation",
    "payload": {
      "duration_seconds": 0.0,
      "harness": "codex",
      "model": null,
      "outcome": "ok",
      "reasoning_effort": null,
      "returncode": 0,
      "tokens": null
    },
    "phase": "remediate",
    "run_id": "deadbeefcafe0000deadbeefcafe0000",
    "schema_version": "1.0",
    "seq": 5,
    "ts": "2026-01-02T03:04:05Z"
  },
  {
    "iteration": "1",
    "kind": "phase_result",
    "payload": {
      "summary": "done"
    },
    "phase": "remediate",
    "run_id": "deadbeefcafe0000deadbeefcafe0000",
    "schema_version": "1.0",
    "seq": 6,
    "ts": "2026-01-02T03:04:05Z"
  },
  {
    "iteration": "1.1",
    "kind": "phase_start",
    "payload": {
      "message": "git status -z --porcelain=v1 --untracked-files=all",
      "payload_schema_version": "1.1",
      "summary": "start"
    },
    "phase": "check",
    "run_id": "deadbeefcafe0000deadbeefcafe0000",
    "schema_version": "1.0",
    "seq": 7,
    "ts": "2026-01-02T03:04:05Z"
  },
  {
    "iteration": "1.1",
    "kind": "check_result",
    "payload": {
      "artifact": "check-1-1.txt",
      "command": "git status -z --porcelain=v1 --untracked-files=all",
      "returncode": 0,
      "status": "passed"
    },
    "phase": "check",
    "run_id": "deadbeefcafe0000deadbeefcafe0000",
    "schema_version": "1.0",
    "seq": 8,
    "ts": "2026-01-02T03:04:05Z"
  },
  {
    "iteration": "1.1",
    "kind": "phase_result",
    "payload": {
      "summary": "passed"
    },
    "phase": "check",
    "run_id": "deadbeefcafe0000deadbeefcafe0000",
    "schema_version": "1.0",
    "seq": 9,
    "ts": "2026-01-02T03:04:05Z"
  },
  {
    "iteration": null,
    "kind": "artifact_write",
    "payload": {
      "kind": "summary",
      "path": "<RUN_DIR>/artifacts/summary.json"
    },
    "phase": "artifacts",
    "run_id": "deadbeefcafe0000deadbeefcafe0000",
    "schema_version": "1.0",
    "seq": 10,
    "ts": "2026-01-02T03:04:05Z"
  },
  {
    "iteration": null,
    "kind": "artifact_write",
    "payload": {
      "bytes": 24,
      "kind": "reviews",
      "path": "<RUN_DIR>/artifacts/review-1.txt"
    },
    "phase": "artifacts",
    "run_id": "deadbeefcafe0000deadbeefcafe0000",
    "schema_version": "1.0",
    "seq": 11,
    "ts": "2026-01-02T03:04:05Z"
  },
  {
    "iteration": null,
    "kind": "artifact_write",
    "payload": {
      "bytes": 11,
      "kind": "remediations",
      "path": "<RUN_DIR>/artifacts/remediation-1.txt"
    },
    "phase": "artifacts",
    "run_id": "deadbeefcafe0000deadbeefcafe0000",
    "schema_version": "1.0",
    "seq": 12,
    "ts": "2026-01-02T03:04:05Z"
  },
  {
    "iteration": null,
    "kind": "artifact_write",
    "payload": {
      "bytes": 1150,
      "kind": "prompts",
      "path": "<RUN_DIR>/artifacts/remediation-1-prompt.txt"
    },
    "phase": "artifacts",
    "run_id": "deadbeefcafe0000deadbeefcafe0000",
    "schema_version": "1.0",
    "seq": 13,
    "ts": "2026-01-02T03:04:05Z"
  },
  {
    "iteration": null,
    "kind": "artifact_write",
    "payload": {
      "bytes": 57,
      "kind": "checks",
      "path": "<RUN_DIR>/artifacts/check-1-1.txt"
    },
    "phase": "artifacts",
    "run_id": "deadbeefcafe0000deadbeefcafe0000",
    "schema_version": "1.0",
    "seq": 14,
    "ts": "2026-01-02T03:04:05Z"
  },
  {
    "iteration": null,
    "kind": "summary",
    "payload": {
      "summary": "max_iterations_reached"
    },
    "phase": null,
    "run_id": "deadbeefcafe0000deadbeefcafe0000",
    "schema_version": "1.0",
    "seq": 15,
    "ts": "2026-01-02T03:04:05Z"
  }
]
